{
  "schema_version": 1,
  "id": "OLD",
  "version": 1,
  "kind": "exposure",
  "created_at": "2026-09-19T11:00:00Z",
  "supersedes": null,
  "actor": "synthetic-custodian",
  "membership_ref": {
    "path": "data/membership/EXPLORED.v1.json",
    "kind": "membership",
    "id": "EXPLORED",
    "version": 1,
    "sha256": "2e112a87bc5cc4d463790ec69af3a37045dcf59caee229ecaf9b17dfc32a8d4f"
  },
  "status": "EXAMINED",
  "purpose": "EXPLORATORY",
  "first_results_access_at": "2026-09-19T11:00:00Z",
  "coverage_through": "2026-09-19T11:00:00Z",
  "evidence": {
    "path": "research/evidence/OLD.json",
    "sha256": "fb73bacd47fa7f63c13ff16de67a1f6471407c9aa6cd648c7b9afb81967bc283",
    "media_type": "application/json"
  },
  "ancestors": [],
  "unknown_reason": null
}
