{
  "schema_version": 1,
  "id": "RENAMED",
  "version": 1,
  "kind": "exposure",
  "created_at": "2026-09-19T11:00:00Z",
  "supersedes": null,
  "actor": "synthetic-custodian",
  "membership_ref": {
    "path": "data/membership/RENAMED.v1.json",
    "kind": "membership",
    "id": "RENAMED",
    "version": 1,
    "sha256": "2199a4410979eeb90dfc838558eae97fc5328957abfffeb735447aca048a3b0e"
  },
  "status": "EXAMINED",
  "purpose": "EXPLORATORY",
  "first_results_access_at": "2026-09-19T11:00:00Z",
  "coverage_through": "2026-09-19T11:00:00Z",
  "evidence": {
    "path": "research/evidence/RENAMED.json",
    "sha256": "fb73bacd47fa7f63c13ff16de67a1f6471407c9aa6cd648c7b9afb81967bc283",
    "media_type": "application/json"
  },
  "ancestors": [],
  "unknown_reason": null
}
